,Unnamed: 0,date,venue,match_category,team_1,team_2,team_1_runs,team_1_wickets,team_2_runs,team_2_wickets,result,pom,best_batters,best_bowlers,commentary_line,world_cup_year,host_country
45,18,2023-10-21, Lucknow,League-Match,NED,SL,262,0,263,5,Sri Lanka won by 5 wickets (with 10 balls remaining),Sadeera Samarawickrama,"['S Samarawickrama - 91 runs ', 'SA Engelbrecht - 70 runs ']","['D Madushanka - 4', 'CAK Rajitha - 4']",,2023,India
46,40,2023-11-09, Bengaluru,League-Match,SL,NZ,171,0,172,5,New Zealand won by 5 wickets (with 160 balls remaining),Trent Boult,"['MDKJ Perera - 51 runs ', 'DP Conway - 45 runs ']","['TA Boult - 3', 'MJ Santner - 2']",8:03pm Time to hear from the captains.,2023,India
47,1,2023-10-06, Hyderabad,League-Match,PAK,NED,286,0,205,0,Pakistan won by 81 runs,Saud Shakeel,"['Saud Shakeel - 68 runs ', 'Mohammad Rizwan - 68 runs ']","['BFW de Leede - 4', 'Haris Rauf - 3']","Scott Edwards, Netherlands captain: It's a bit disappointing. Firstly, we bowled and fielded well. We thought they were par. We thought we had a good chance at 2 for 120. Probably a bit of instinct. So many of our bats bowl spin. De Leede is a quality cricket in all three departments. His innings was awesome, just needed someone to be with him. Not spoken to van Beek, need to see where he's at. This is a game that got away. We know they have quality bowlers but they took wickets which held us back.",2023,India
48,44,2023-11-12, Bengaluru,League-Match,IND,NED,410,4,250,0,India won by 160 runs,Shreyas Iyer,"['SS Iyer - 128 runs ', 'KL Rahul - 102 runs ']","['JJ Bumrah - 2', 'Kuldeep Yadav - 2']",,2023,India
49,6,2023-10-10, Dharamsala,League-Match,ENG,BAN,364,9,227,0,England won by 137 runs,Dawid Malan,"['DJ Malan - 140 runs ', 'JE Root - 82 runs ']","['RJW Topley - 4', 'Mahedi Hasan - 4']","Afeef: ""Eng have a positive NRR now. That's good, they've neutralised the thumping they got in the previous match.""",2023,India
